,Address,Name Tag,Balance,Txn Count
0,0xd721a90dd7e010c8c5e022cc0100c55ac78e0fc4,Revest Finance: Address Registry,0 ETH,20
1,0x9b3cab26947f15b4fcbf70d258989d58fc8e1d66,Revest Finance: Chainlink Oracle,0 ETH,3
2,0xeb3bc40acebabf62d31b0d52fe3ff327b7c82cbc,Revest Finance: Combo Lock,0 ETH,2
3,0xc03bb46b3bfd42e6a2bf20ad6fa660e4bd3736f8,Revest Finance: Cronje Sun V3 TWAP,0 ETH,3
4,0xe952bda8c06481506e4731c4f54ced2d4ab81659,Revest Finance: FNFT Handler,0 ETH,314
5,0x226124e83868812d3dae87eb3c5f28047e1070b7,Revest Finance: Lock Manager,0 ETH,2
6,0x5b7a093949aaa9ef70e5a563e50aaf5f60154602,Revest Finance: Metadata,0 ETH,2
7,0x2320a28f52334d62622cc2eafa15de55f9987ed9,Revest Finance: Revest,0 ETH,591
8,0xa4e7f2a1edb5ad886baa09fb258f8aca7c934ba6,Revest Finance: Rewards Handler,0 ETH,57
9,0x120a3879da835a5af037bb2d1456bebd6b54d4ba,Revest Finance: RVST Token,0 ETH,7600
10,0x07317ed9204c9e76df03f106ceffd5b021c5f6a5,Revest Finance: Staking,0 ETH,2
11,0xfd7e5a314b46b41a97d0c5ee6f2a9559e877a756,Revest Finance: Supply Lock,0 ETH,2
12,0xa81bd16aa6f6b25e66965a2f842e9c806c0aa11f,Revest Finance: Token Vault,0 ETH,2
13,0x13cd285a7209901f48978b690f1082b25396912b,Revest Finance: Uniswap Oracle,0 ETH,4
