,Address,Name Tag,Balance,Txn Count
0,0x0e1177e47151be72e5992e0975000e73ab5fd9d4,OlympusDAO: Aave Allocator V1,0 Ether,5
1,0x4cbd58469c964f999a380fd8180e1c645de35801,OlympusDAO: Abracadabra Custom Bond,0 Ether,333
2,0x80154a49dc3217e5b1ef313f9f45293e95b91030,OlympusDAO: Abracadabra Custom Treasury,0 Ether,0
3,0x24ecfd535675f36ba1ab9c5d39b50dc097b0792e,OlympusDAO: aOHM V1,0 Ether,1164
4,0x3df5a355457db3a4b5c744b8623a7721bf56df78,OlympusDAO: Convex Allocator V1,0 Ether,8
5,0xa64ed1b66cb2838ef2a198d8345c0ce6967a2a3c,OlympusDAO: DAI Bond V1,0 Ether,1053
6,0xd03056323b7a63e2095ae97fa1ad92e4820ff045,OlympusDAO: DAI Bond V2,0 Ether,958
7,0x575409f8d77c12b05fed8b455815f0e54797381c,OlympusDAO: DAI Bond V3,0 Ether,9796
8,0x245cc372c84b3645bf0ffe6538620b04a217988b,OlympusDAO: DAO Funds,13.0601726 Ether,702
9,0x7464a65aa3fc15a625e2adfb8b340277d804d90d,OlympusDAO: ETH Bond V1,0 Ether,5
10,0xe6295201cd1ff13ced5f063a5421c39a1d236f1c,OlympusDAO: ETH Bond V2,0 Ether,4937
11,0xc9ce759c809e8026c8fc1b66536031d81d6c3d1c,OlympusDAO: Float Protocol Custom Bond,0 Ether,238
12,0x18e30f61797f47c30695464a2a17f6e68a236c96,OlympusDAO: Float Protocol Custom Treasury,0 Ether,0
13,0x8510c8c2b6891e04864fa196693d44e6b6ec2514,OlympusDAO: FRAX Bond V1,0 Ether,3099
14,0x10c0f93f64e3c8d0a1b0f4b87d6155fd9e89d08d,OlympusDAO: LUSD Bond V1,0 Ether,3306
15,0x64aa3364f17a4d01c6f1751fd97c2bd3d7e7f1d5,OlympusDAO: OHM Token,0 Ether,71669
16,0xd27001d1aaed5f002c722ad729de88a91239ff29,OlympusDAO: OHM/DAI LP Bond V1,0 Ether,1509
17,0x13e8484a86327f5882d1340ed0d7643a29548536,OlympusDAO: OHM/DAI LP Bond V2,0 Ether,302
18,0x996668c46fc0b764afda88d83eb58afc933a1626,OlympusDAO: OHM/DAI LP Bond V3,0 Ether,378
19,0x956c43998316b6a2f21f89a1539f73fb5b78c151,OlympusDAO: OHM/DAI LP Bond V4,0 Ether,11111
20,0x539b6c906244ac34e348bbe77885cdfa994a3776,OlympusDAO: OHM/FRAX LP Bond V1,0 Ether,234
21,0xc20cfff07076858a7e642e396180ec390e5a02f7,OlympusDAO: OHM/FRAX LP Bond V2,0 Ether,3714
22,0xfb1776299e7804dd8016303df9c07a65c80f67b6,OlympusDAO: OHM/LUSD LP Bond V1,0 Ether,2162
23,0x11ac5c608c6b2c57ed58ee43281f7ba52205b17a,OlympusDAO: Pendle Custom Bond,0 Ether,655
24,0xde5adb36558fb31137ffd02e4046d4f1bf3d7bd0,OlympusDAO: Pendle Custom Treasury,0 Ether,0
25,0x36994486c6e97c170065899d8659a28d7371c800,OlympusDAO: pOHM V1,0 Ether,191
26,0x0cf30dc0d48604a301df8010cdc028c055336b2e,OlympusDAO: Policy,0 Ether,323
27,0xe1e83825613de12e8f0502da939523558f0b819e,OlympusDAO: Redeem Helper,0 Ether,2611
28,0x31932e6e45012476ba3a3a4953cba62aee77fbbe,OlympusDAO: sOHM V1,0 Ether,6866
29,0x04f2694c8fcee23e8fd0dfea1d4f5bb8c352111f,OlympusDAO: sOHM V2,0 Ether,153514
30,0x903de5b04b9878696ffa08bd300cc06b260fc5c9,OlympusDAO: StakeDAO Custom Bond,0 Ether,288
31,0x3f60e5f9437b79ea30135eb75d3a907944eef303,OlympusDAO: StakeDAO Custom Treasury,0 Ether,0
32,0xbe731507810c8747c3e01e62c676b1ca6f93242f,OlympusDAO: Staking Distributor V1,0 Ether,73
33,0xce6568338708400d03f430d29f2eb40a33a3f4c4,OlympusDAO: Staking Distributor V2,0 Ether,114
34,0x73cfe6b116d161a2f9c165f7fc5270fb7dd2bb1e,OlympusDAO: Staking Distributor V3,0 Ether,50
35,0xc58e923bf8a00e4361fe3f4275226a543d7d3ce6,OlympusDAO: Staking Distributor V4,0 Ether,29
