,#,Contract Address,Token Name,Market Cap,Holders,Website
0,1,0xc5102fE9359FD9a28f877a67E36B0F050d81a3CC,Hop (HOP),"$14,923,914.00",3852,
1,2,0x9f93aca246f457916e49ec923b8ed099e313f763,Tether USD Hop Token (hUSDT),$0.00,2107,
2,3,0x712f0cf37bdb8299d0666727f73a5caba7c1c24c,Matic Token Hop Token (hMATIC),$0.00,6006,
3,4,0xb8901acb165ed027e32754e0ffe830802919727f,DAI Hop Token (hDAI),$0.00,2603,
4,5,0x8b7aa8f5cc9996216a88d900df8b8a0a3905939a,Hop DAI LP Token (HOP-LP-DAI),$0.00,1898,
5,6,0x1fdeaf938267ca43388ed1fdb879eaf91e920c7a,ETH Hop Token (hETH),$0.00,9068,
6,7,0x971039bf0a49c8d8a675f839739ee7a42511ec91,Hop ETH LP Token (HOP-LP-ETH),$0.00,6483,
7,8,0x3ca3218d6c52b640b0857cc19b69aa9427bc842c,Hop USDT LP Token (HOP-LP-USDT),$0.00,6833,
8,9,0x9ec9551d4a1a1593b0ee8124d98590cc71b3b09d,USD Coin Hop Token (hUSDC),$0.00,8070,
9,10,0x9d373d22fd091d7f9a6649eb067557cc12fb1a0a,Hop USDC LP Token (HOP-LP-USDC),$0.00,9527,
10,11,0xbc4fb4ed825c65ff48163af7e59d49e32edb5269,Hop MATIC LP Token (HOP-LP-MATIC),$0.00,7378,
