,Address,Name Tag,Balance,Txn Count
0,0xf82b1fdcd493b2defab52c740399ff150baa7a2a,Allnodes: Lido Node Operator,1.95161198 ETH,249
1,0x1dd909cddf3dbe61ac08112dc0fdf2ab949f79d8,Anyblock Analytics: Lido Node Operator,0 ETH,58
2,0x753d5167c31fbeb5b49624314d74a957eb271709,Attestant (BVI) Limited: Lido Node Operator,17.54086862 ETH,300
3,0x7f39c581f595b53c5cb19bd0b3f8da6c935e2ca0,Blockdaemon: Lido Node Operator,0.08672837 ETH,255
4,0x8845d7f2bbfe82249c3b95e378a6ed039dd953f5,Blockscape: Lido Node Operator,1.61202459 ETH,629
5,0x8d689476eb446a1fb0065bffac32398ed7f89165,BridgeTower Capital: Lido Node Operator,0.41780707 ETH,313
6,0xc1a900ae76db21dc5aa8e418ac0f4e888a4c7431,Certus One: Lido Node Operator,33.12953982 ETH,618
7,0xdd4bc51496dc93a0c47008e820e0d80745476f22,ChainLayer: Lido Node Operator,2.61483579 ETH,221
8,0xd5ac23b1ade91a054c4974264c9dbddd0e52bb05,ChainSafe: Lido Node Operator,3.77009114 ETH,185
9,0xa2dfc431297aee387c05beef507e5335e684fbcd,Chorus One: Lido Node Operator,2.64716068 ETH,289
10,0x49df3cca2670eb0d591146b16359fe336e476f29,CryptoManufaktur: Lido Node Operator,0.34012337 ETH,664
11,0xf73a1260d222f447210581ddf212d915c09a3249,DSRV: Lido Node Operator,1.35493451 ETH,380
12,0x5f74a2db08d717c94457c550af54548c4241ace9,Everstake: Lido Node Operator,2.25804719 ETH,632
13,0x77781a93c4824d2299a38ac8bbb11eb3cd6bc3b7,Figment Capital: Lido Node Operator,0.84148104 ETH,230
14,0x1597d19659f3de52abd475f7d2314dcca29359bd,hashQuark: Lido Node Operator,0.749047 ETH,256
15,0x0f25c1dc2a9922304f2eac71dca9b07e310e8e5a,InfStones: Lido Node Operator,0.34602811 ETH,246
16,0xfe5986e06210ac1ecc1adcafc0cc7f8d63b3f977,Kukis Global: Lido Node Operator,3.984521 ETH,273
17,0x3e40d73eb977dc6a537af587d48316fee66e9c8c,Lido: 1inch Liquidity Farming,0 ETH,146
18,0x3a6bd15abf19581e411621d669b6a2bbe741ffd6,Lido: 1inch LP Rewards Manager,0 ETH,7
19,0x8b90ac446d4360332129e92f857a9d536db9d7c2,Lido: 1inch stETH-DAI Pool,0 ETH,680
20,0x0ac7e9af32422ac5968622585822e4d89ef51343,Lido: Add Reward Program,0 ETH,1
21,0xc0b581e041c17716ea1fcede4ec40e2e27a48aba,Lido: Aragon ACL,0 ETH,0
22,0xfef3c7aa6956d03dbad8959c59155c4a465dcacd,Lido: Aragon Finance,0 ETH,5
23,0x0d97e876ad14db2b183cfeeb8aa1a5c788eb1831,Lido: Aragon Token Manager,0 ETH,160
24,0x3129c041b372ee93a5a8756dc4ec6f154d85bc9a,Lido: Aragon Voting,0 ETH,1222
25,0xcd51df5142156bd92e7a9494dd2b9362f5078d64,Lido: Arbitrum L1 ERC20 Token Gateway,0 ETH,14
26,0x442af784a788a5bd6f42a01ebe9f287a871243fb,Lido: ARCx Manager Contract,0 ETH,4
27,0x55a7e1cbd678d9ebd50c7d69dc75203b0dbdd431,Lido: Balancer LP rewards Manager Contract,0 ETH,26
28,0xf0211b7660680b49de1a7e9f25c65660f0a13fea,Lido: Balancer LP Rewards Manager V2,0 ETH,6
29,0x648c8be548f43eca4e482c0801ebccccfb944931,Lido: Balancer LP Rewards V2,0 ETH,15
30,0x9a66fd7948a6834176fbb1c4127c61cb6d349561,Lido: Balancer wstETH-ETH Pool,0 ETH,1650
31,0xf5dc67e54fc96f993cd06073f71ca732c1e654b1,Lido: Chainlink stETH-ETH Price Feed,0 ETH,2
32,0xe19fc582dd93fa876cf4061eb5456f310144f57b,Lido: Chainlink stETH-USD Price Feed,0 ETH,2
33,0xb8d83908aab38a159f3da47a59d84db8e1838712,Lido: Composite Post Rebase Report Receiver,0 ETH,1
34,0x86392dc19c0b719886221c78ab11eb8cf5c52812,Lido: Curve Liquidity Farming Manager Contract,0 ETH,32
35,0x55bc991b2edf3ddb4c520b222be4f378418ff0fa,Lido: Curve Liquidity Farming Pool Contract,"230,941.40820062 ETH",65237
36,0xfebd8fac16de88206d4b18764e826af38546afe0,Lido: Curve Liquidity Farming Reward Contract,0 ETH,1
37,0xf5436129cf9d8fa2a1cb6e591347155276550635,Lido: Deployer 1,11.27785462 ETH,159
38,0xdb149235b6f40dc08810aa69869783be101790e7,Lido: Deployer 2,0 ETH,1
39,0x9d15032b91d01d5c1d940eb919461426ab0dd4e3,Lido: Deployer 3,1.61911014 ETH,121
40,0x32296969ef14eb0c6d29669c550d4a0449130230,Lido: Deposit Security Module,0 ETH,1426
41,0x55032650b14df07b85bf18a3a3ec8e0af2e028d5,Lido: Deposit Security Module 2,0 ETH,2135
42,0xfe78617ec612ac67bcc9cc145d376400f15a82cb,Lido: Early Stakers Airdrop,0 ETH,368
43,0xb3dfe140a77ec43006499cb8c2e5e31975cad909,Lido: Easy Track,0 ETH,591
44,0xdb46c277da1599390eab394327602889e9546296,Lido: EVM Script Executor,0 ETH,2
45,0x987cc5111389a1f58bc7f678c95f485631205ec3,Lido: Execution Layer Rewards Vault,49.87105381 ETH,469288
46,0xfea88380baff95e85305419eb97247981b1a8eee,Lido: Finance Multisig,4.21746592 ETH,62
47,0xb8ffc3cd6e7cf5a098a1c92f48009765b24088dc,Lido: Increase Node Operator Staking Limit,0 ETH,1
48,0x5a98fcbea516cf06857215779fd812ca3bef1b32,Lido: LDO Token,0 ETH,166741
49,0xdc24316b9ae028f1497c275eb9192a3ea0f67022,Lido: Lido App Repo,0 ETH,0
50,0xe5576eb1dd4aa524d67cf9a32c8742540252b6f4,Lido: Lido Oracle Repo,0 ETH,0
51,0x59ecf48345a221e0731e785ed79ed40d0a94e2a5,Lido: LIDO Vesting Recipient 1,0.001 ETH,42
52,0xb9d7934878b5fb9610b3fe8a5e441e8fad7e293f,Lido: LIDO Vesting Recipient 2,0.001 ETH,2
53,0x945755de7eac99008c8c57bda96772d50872168b,Lido: LIDO Vesting Recipient 3,6.9929796 ETH,151
54,0x3bf3a9260fe18a1239767ac6f0f0bc7c1e5d1cbc,Lido: LIDO Vesting Recipient 4,0.002 ETH,2
55,0x58a764028350ab15899fdccafffd3940e602ceea,Lido: LIDO Vesting Recipient 5,0.001 ETH,10
56,0x77d2cf58aa4da90b3afcd283646568e4383193bf,Lido: LIDO Vesting Recipient 6,0.001 ETH,3
57,0x4ee3118e3858e8d7164a634825bfe0f73d99c792,Lido: LIDO Vesting Recipient 7,123.84408115 ETH,69
58,0x55c8de1ac17c1a937293416c9bce5789cbbf61d1,Lido: LIDO Vesting Recipient 8,0 ETH,7
59,0xc21e5e72ffc223f02fc410aaede3084a63963932,Lido: LIDO Vesting Recipient 9,0.002 ETH,1
60,0x87d93d9b2c672bf9c9642d853a8682546a5012b5,Lido: MEV Boost Relay Allowed List,0 ETH,2
61,0xcfe54b5cd566ab89272946f602d76ea879cab4a8,Lido: Node Operators Registry,0 ETH,5392
62,0xae7ab96520de3a18e5e111b5eaab095312d7fe84,Lido: Node Operators Registry Repo,0 ETH,0
63,0x76943c0d61395d8f2edf9060e1533529cae05de6,Lido: Optimism L1 ERC20 Token Bridge,0 ETH,1244
64,0xab55bf4dfbf469ebfe082b7872557d1f87692fe6,Lido: Oracle,0 ETH,3041
65,0x2e59a20f205bb85a89c53f1936454680651e618e,Lido: Remove Reward Program,0 ETH,1
66,0x388c818ca8b9251b393131c08a736a67ccb19297,Lido: Reward Programs Registry,0 ETH,1
67,0x40c20da8d0214a7ef33a84e287992858db744e6d,Lido: Rewards Committee Multisig,0.08605 ETH,273
68,0xd7f0ddcbb0117a53e9ff2cad814b8b810a314f59,Lido: Self Owned stETH Burner,0 ETH,1
69,0xb280e33812c0b09353180e92e27b8ad399b07f26,Lido: Stable Swap Oracle,0 ETH,3
70,0x07fe5f404778c27f4d3a0ab56dc59f8efdd32d96,Lido: Staked ETH Token,"1,688.32358059 ETH",455674
71,0xb9e5cbb9ca5b0d659238807e84d0176930753d86,Lido: stETH Price Feed,0 ETH,5
72,0x3d5a107f7a5bcec8734c49ed54d41bc6f93eb97f,Lido: SushiSwap LP rewards Manager Contract,0 ETH,11
73,0x1220cccdc9bba5cf626a84586c74d6f940932342,Lido: SushiSwap LP rewards Reward Contract,0 ETH,1
74,0x60bc65e1cca448f98578f8d9f9ab64c3ba70a4c3,Lido: Top Up Lego Program,0 ETH,1
75,0x710b3303fb508a84f10793c1106e32be873c24cd,Lido: Top Up Reward Programs,0 ETH,1
76,0x4b3edb22952fb4a70140e39fb1add05a6b49622b,Lido: Treasury,"20,304.35678619 ETH",29
77,0x9895f0f17cc1d1891b6f18ee0b483b6f221b37bb,Lido: Voting Repo,0 ETH,0
78,0x065daab531e7cd50f900d644e8cae8a208eea4e9,Lido: Withdrawals Manager Stub,71.5498095 ETH,2
79,0xd8d93e91ea5f24d0e2a328bc242055d40f00be1a,Lido: wrapped stETH Token,0 ETH,37715
80,0x75ff3dd673ef9fc459a52e1054db5df2a1101212,Nethermind: Lido Node Operator,24.07696 ETH,1117
81,0x4f42a816dc2dba82ff927b6996c14a741dcbd902,P2P.ORG: Lido Node Operator,5.03754239 ETH,421
82,0x48f300bd3c52c7da6aabde4b683deb27d38b9abb,Prysmatic Labs: Lido Node Operator,0 ETH,223
83,0xf9339de629973c60c4d2b76749c81e6f40960e3a,RockX: Lido Node Operator,14.08548044 ETH,341
84,0x695c388153bea0fbe3e1c049c149bad3bc917740,Sigma Prime: Lido Node Operator,3.63160698 ETH,208
85,0x6140182b2536ae7b6cfcfb2d2bab0f6fe0d7b58e,Simply Staking: Lido Node Operator,0.25721702 ETH,258
86,0xf95f069f9ad107938f6ba802a3da87892298610e,stakefish: Lido Node Operator,8.29304462 ETH,247
87,0x237dee529a47750becdfa8a59a1d766e3e7b5f91,Stakely: Lido Node Operator,0.16236964 ETH,245
88,0xf6b0a1b771633db40a3e21cc49fd2fe35669ef46,Stakin: Lido Node Operator,0.39996362 ETH,240
89,0x99ac10631f69c753ddb595d074422a0922d9056b,Staking Facilities: Lido Node Operator,2.35625378 ETH,1991
90,0x258cb32b1875168858e57bb31482054e008d344e,stereum.net 2: Eth2 Depositor,0.16899426 ETH,264
